834, Frumpy Hair B&W, u, l, Attribute, 
835, Headband B&W, u, l, Attribute, 
836, Heart Eyes B&W, u, l, Attribute, 
837, Knitted Cap B&W, u, l, Attribute, 
838, Laser Eyes B&W, u, l, Attribute, 
839, Medical Mask B&W, u, l, Attribute, 
840, Messy Hair B&W, u, l, Attribute, 
841, Mohawk B&W, u, l, Attribute, 
842, Mouth B&W, u, l, Attribute, 
843, Mouth Big B&W, u, l, Attribute, Ape Mouth B&W | Alien Mouth B&W
844, Nose B&W, u, l, Attribute, 
845, Nose Small B&W, u, l, Attribute, 
846, Nose Up B&W, u, l, Attribute, Scream Nose B&W
847, Nose Up Big B&W, u, l, Attribute, Alien Nose B&W
848, Orc Eyes B&W, u, l, Attribute, Frankenstein Eyes B&W
849, Orc Mouth B&W, u, l, Attribute, 
850, Orc Mouth Small B&W, u, l, Attribute, 
851, Orc Nose B&W, u, l, Attribute, 
852, Robot Eyes B&W, u, l, Attribute, 
853, Robot Mouth B&W, u, l, Attribute, 
854, Peak Spike B&W, u, l, Attribute, 
855, Pipe B&W, u, l, Attribute, 
856, Police Cap B&W, u, l, Attribute, 
857, Regular Shades B&W, u, l, Attribute, 
858, Santa Hat B&W, u, l, Attribute, 
859, Scream Eyes B&W, u, l, Attribute, 
860, Scream Mouth B&W, u, l, Attribute, 
861, Skeleton Eyes B&W, u, l, Attribute, 
862, Skeleton Mouth B&W, u, l, Attribute, Frankenstein Mouth B&W
863, Small Shades B&W, u, l, Attribute, 
864, Smile B&W, u, l, Attribute, 
865, Smile Big B&W, u, l, Attribute, 
866, Spots B&W, u, l, Attribute, 
867, Sun Hat B&W, u, l, Attribute, 
868, Vampire Mouth B&W, u, l, Attribute, 
869, Vampire Mouth Small B&W, u, l, Attribute, 
870, VR B&W, u, l, Attribute, 
871, Zombie Eyes B&W, u, l, Attribute, 
872, Zombie Mouth B&W, u, l, Attribute, 
873, Big Beard (Natural), m, l, Attribute, 
874, Goat (Natural), m, l, Attribute, 
875, Cap Forward (Natural), u, l, Attribute, 
876, Cigarette (Natural), u, l, Attribute, 
877, Do-rag (Natural), u, l, Attribute, 
878, Earring (Natural), u, l, Attribute, Gold Earring (Natural)
879, Headband (Natural), u, l, Attribute, 
880, Knitted Cap (Natural), u, l, Attribute, 
881, Mohawk (Natural), u, l, Attribute, 
882, Mohawk Thin (Natural), u, l, Attribute, 
883, Pipe (Natural), u, l, Attribute, 
884, Police Cap (Natural), u, l, Attribute, 
885, Shaved Head (Natural), u, l, Attribute, 
886, VR (Natural), u, l, Attribute, 
887, Cigarette (Natural), f, s, Attribute, 
888, Earring (Natural), f, s, Attribute, Gold Earring (Natural)
889, Mohawk (Natural), f, s, Attribute, 
890, Mohawk Thin (Natural), f, s, Attribute, 
891, Pipe (Natural), f, s, Attribute, 
