257, Alien (Ape) 270°, m, l, Archetype - Alien, Alien (Ape) Male 270° | Alien (Ape) 270° ♂ | Alien (Ape) Violet | Alien (Ape) Male Violet | Alien (Ape) Violet ♂
258, Alien (Ape) 300°, m, l, Archetype - Alien, Alien (Ape) Male 300° | Alien (Ape) 300° ♂ | Alien (Ape) Magenta | Alien (Ape) Male Magenta | Alien (Ape) Magenta ♂
259, Alien (Ape) 330°, m, l, Archetype - Alien, Alien (Ape) Male 330° | Alien (Ape) 330° ♂ | Alien (Ape) Red Magenta | Alien (Ape) Male Red Magenta | Alien (Ape) Red Magenta ♂
260, Alien Female 0°, f, s, Archetype - Alien, Alien 0° ♀ | Alien Female Red | Alien Red ♀
261, Alien Female 30°, f, s, Archetype - Alien, Alien 30° ♀ | Alien Female Orange | Alien Orange ♀
262, Alien Female 60°, f, s, Archetype - Alien, Alien 60° ♀ | Alien Female Yellow | Alien Yellow ♀
263, Alien Female 90°, f, s, Archetype - Alien, Alien 90° ♀ | Alien Female Yellow Green | Alien Yellow Green ♀
264, Alien Female 120°, f, s, Archetype - Alien, Alien 120° ♀ | Alien Female Green | Alien Green ♀
265, Alien Female 150°, f, s, Archetype - Alien, Alien 150° ♀ | Alien Female Cyan Green | Alien Cyan Green ♀
266, Alien Female 180°, f, s, Archetype - Alien, Alien 180° ♀ | Alien Female Cyan | Alien Cyan ♀
267, Alien Female 210°, f, s, Archetype - Alien, Alien 210° ♀ | Alien Female Cyan Blue | Alien Cyan Blue ♀
268, Alien Female 240°, f, s, Archetype - Alien, Alien 240° ♀ | Alien Female Blue | Alien Blue ♀
269, Alien Female 270°, f, s, Archetype - Alien, Alien 270° ♀ | Alien Female Violet | Alien Violet ♀
270, Alien Female 300°, f, s, Archetype - Alien, Alien 300° ♀ | Alien Female Magenta | Alien Magenta ♀
271, Alien Female 330°, f, s, Archetype - Alien, Alien 330° ♀ | Alien Female Red Magenta | Alien Red Magenta ♀
272, Human 1-II (F), m, l, Archetype - Human, Human Male 1-II (F) | Human 1-II ♂ (F) | Male 1-II (F)
273, Human 2-II (F), m, l, Archetype - Human, Human Male 2-II (F) | Human 2-II ♂ (F) | Male 2-II (F)
274, Human 3-II (F), m, l, Archetype - Human, Human Male 3-II (F) | Human 3-II ♂ (F) | Male 3-II (F)
275, Human 4-II (F), m, l, Archetype - Human, Human Male 4-II (F) | Human 4-II ♂ (F) | Male 4-II (F)
276, Human B&W II, m, l, Archetype - Human, Human Male B&W II | Human B&W II ♂ | Male B&W II | Male 1-Bit II
277, Human Female 1-II (F), f, l, Archetype - Human, Human 1-II ♀ (F) | Female 1-II (F)
278, Human Female 2-II (F), f, l, Archetype - Human, Human 2-II ♀ (F) | Female 2-II (F)
279, Human Female 3-II (F), f, l, Archetype - Human, Human 3-II ♀ (F) | Female 3-II (F)
280, Human Female 4-II (F), f, l, Archetype - Human, Human 4-II ♀ (F) | Female 4-II (F)
281, Human Female B&W II, f, l, Archetype - Human, Human B&W II ♀ | Female B&W II | Female 1-Bit II
282, Eyebrows, u, l, Attribute, 
283, Eyes, u, l, Attribute, 
284, Mouth, u, l, Attribute, 
285, Nose, u, l, Attribute, 
286, Nose Small, u, l, Attribute, Small Nose
287, Mouth Darker, f, u, Attribute, Mouth 1
288, Mouth Dark, f, u, Attribute, Mouth 2
289, Mouth Light, f, u, Attribute, Mouth 3
290, Mouth Lighter, f, u, Attribute, Mouth 4
291, Smile Darker, f, u, Attribute, Smile 1
292, Smile Dark, f, u, Attribute, Smile 2
293, Smile Light, f, u, Attribute, Smile 3
294, Smile Lighter, f, u, Attribute, Smile 4
295, Smile Zombie, f, u, Attribute, 
296, Frown Darker, f, u, Attribute, Frown 1
297, Frown Dark, f, u, Attribute, Frown 2
298, Frown Light, f, u, Attribute, Frown 3
299, Frown Lighter, f, u, Attribute, Frown 4
300, Frown Zombie, f, u, Attribute, 
301, 3D Glasses, u, l, Attribute, 
302, 3D Glasses, f, s, Attribute, 
303, Big Shades, u, l, Attribute, 
304, Big Shades, f, s, Attribute, 
305, Classic Shades, u, l, Attribute, 
306, Classic Shades, f, s, Attribute, 
307, Eye Mask, u, l, Attribute, 
308, Eye Mask, f, s, Attribute, 
309, Eye Patch, u, l, Attribute, 
310, Eye Patch, f, s, Attribute, 
311, Horned Rim Glasses, u, l, Attribute, 
312, Horned Rim Glasses, f, s, Attribute, 
313, Nerd Glasses, u, l, Attribute, 
314, Nerd Glasses, f, s, Attribute, 
315, Regular Shades, u, l, Attribute, 
316, Regular Reflective Shades, u, l, Attribute, Regular Shades Reflective
317, Regular Shades, f, s, Attribute, 
318, Small Shades, u, l, Attribute, 
319, Small Shades, f, s, Attribute, 
320, VR, u, l, Attribute, 
321, VR, f, s, Attribute, 
322, Welding Goggles, f, s, Attribute, 
323, Heart Shades, u, l, Attribute, 
324, Heart Shades, f, s, Attribute, 
325, Ski Googles, u, l, Attribute, 
326, Ski Googles, f, s, Attribute, 
327, Laser Eyes, u, l, Attribute, Laser Eyes Red
328, Laser Eyes, f, s, Attribute, Laser Eyes Red
329, Laser Eyes Gold, u, l, Attribute, 
330, Laser Eyes Gold, f, s, Attribute, 
331, Tears, u, l, Attribute, 
332, Tears, f, s, Attribute, 
333, Blue Eye Shadow, f, s, Attribute, 
334, Green Eye Shadow, f, s, Attribute, 
335, Green Eye Shadow, f, l, Attribute, 
336, Purple Eye Shadow, f, s, Attribute, 
337, Clown Eyes Blue, u, l, Attribute, 
338, Clown Eyes Blue, f, s, Attribute, 
339, Clown Eyes Green, u, l, Attribute, 
340, Clown Eyes Green, f, s, Attribute, 
341, Clown Eyes Purple, u, l, Attribute, 
342, Clown Eyes Purple, f, s, Attribute, 
343, Mole, u, l, Attribute, 
344, Mole, f, s, Attribute, 
345, Rosy Cheeks, u, l, Attribute, 
346, Rosy Cheeks, f, s, Attribute, 
347, Spots, u, l, Attribute, 
348, Spots, f, s, Attribute, 
349, Clown Nose, u, l, Attribute, Clown Nose Red
350, Clown Nose, f, s, Attribute, Clown Nose Red
351, Clown Nose Blue, u, l, Attribute, 
352, Clown Nose Blue, f, s, Attribute, 
353, Clown Nose Green, u, l, Attribute, 
354, Clown Nose Green, f, s, Attribute, 
355, Earring, u, l, Attribute, Gold Earring
356, Earring, f, s, Attribute, Gold Earring
357, Silver Earring, u, l, Attribute, 
358, Silver Earring, f, s, Attribute, 
359, Buck Teeth, m, l, Attribute, 
360, Frown, m, l, Attribute, 
361, Smile, m, l, Attribute, 
362, Black Lipstick, f, u, Attribute, 
363, Hot Lipstick, f, u, Attribute, 
364, Purple Lipstick, f, u, Attribute, 
365, Pink Lipstick, f, u, Attribute, 
366, Red Lipstick, f, u, Attribute, 
367, Cigarette, u, l, Attribute, 
368, Cigarette, f, s, Attribute, 
369, Medical Mask, u, l, Attribute, 
370, Medical Mask, f, s, Attribute, 
371, Pipe, u, l, Attribute, 
372, Pipe, f, s, Attribute, 
373, Vape, u, l, Attribute, 
374, Vape, f, s, Attribute, 
375, Bubble Gum, u, l, Attribute, 
376, Bubble Gum, f, s, Attribute, 
377, Cigar, u, l, Attribute, 
378, Cigar, f, s, Attribute, 
379, Choker, f, u, Attribute, 
380, Gold Chain, m, l, Attribute, 
381, Gold Chain, f, u, Attribute, 
382, Silver Chain, m, l, Attribute, 
383, Silver Chain, f, u, Attribute, 
384, Gold Diamond Chain, m, l, Attribute, Gold Diamond Necklace
385, Gold Diamond Chain, f, u, Attribute, Gold Diamond Necklace
386, Big Beard, m, l, Attribute, 
387, Chinstrap, m, l, Attribute, 
388, Front Beard, m, l, Attribute, 
389, Front Beard Dark, m, l, Attribute, 
390, Goat, m, l, Attribute, 
391, Handlebars, m, l, Attribute, 
392, Luxurious Beard, m, l, Attribute, 
393, Mustache, m, l, Attribute, 
394, Muttonchops, m, l, Attribute, 
395, Normal Beard, m, l, Attribute, 
396, Normal Beard Black, m, l, Attribute, 
397, Shadow Beard, m, l, Attribute, 
398, Bandana, u, l, Attribute, 
399, Bandana, f, s, Attribute, 
400, Beanie, u, l, Attribute, 
401, Beanie, f, s, Attribute, 
402, Cap Forward, u, l, Attribute, 
403, Cap Forward, f, s, Attribute, 
404, Cowboy Hat, u, l, Attribute, 
405, Cowboy Hat, f, s, Attribute, 
406, Do-rag, u, l, Attribute, 
407, Do-rag, f, s, Attribute, 
408, Fedora, u, l, Attribute, Fedora 1
409, Fedora, f, s, Attribute, Fedora 1
410, Headband, u, l, Attribute, 
411, Headband, f, s, Attribute, Headband 1 | Black with Headband
412, Headband 2, f, s, Attribute, 
413, Hoodie, m, l, Attribute, 
414, Hoodie, f, l, Attribute, 
415, Hoodie, f, s, Attribute, 
416, Knitted Cap, u, l, Attribute, 
417, Knitted Cap, f, s, Attribute, 
418, Pilot Helmet, f, s, Attribute, 
419, Police Cap, u, l, Attribute, 
420, Police Cap, f, s, Attribute, 
421, Tassle Hat, f, s, Attribute, 
422, Tiara, f, s, Attribute, 
423, Top Hat, u, l, Attribute, 
424, Top Hat, f, s, Attribute, 
425, Demon Horns, u, l, Attribute, 
426, Demon Horns, f, s, Attribute, 
427, Bear Hood, m, l, Attribute, 
428, Bear Hood, f, s, Attribute, 
429, Birthday Hat, u, l, Attribute, 
430, Birthday Hat, f, s, Attribute, 
431, Bow, f, s, Attribute, 
432, Crown, u, l, Attribute, 
433, Crown, f, s, Attribute, 
434, Flowers, f, s, Attribute, 
435, Frog Hood, m, l, Attribute, 
436, Frog Hood, f, s, Attribute, 
437, Jester Hat, u, l, Attribute, 
438, Jester Hat, f, s, Attribute, 
439, Santa Hat, u, l, Attribute, 
440, Santa Hat, f, s, Attribute, 
441, Sombrero, u, l, Attribute, Sombrero 1
442, Sombrero, f, s, Attribute, Sombrero 1
443, Sun Hat, u, l, Attribute, 
444, Sun Hat, f, s, Attribute, 
445, Superhero Tiara, f, s, Attribute, 
446, Viking Helmet, u, l, Attribute, 
447, Viking Helmet, f, s, Attribute, 
448, Winter Hat, u, l, Attribute, 
449, Winter Hat, f, s, Attribute, 
450, Wizard Hat, u, l, Attribute, 
451, Australian Cork Hat, m, l, Attribute, 
452, Australian Cork Hat, f, s, Attribute, 
453, Ayam, m, l, Attribute, 
454, Ayam, f, s, Attribute, 
455, Bamboo Hat, m, l, Attribute, 
456, Bamboo Hat, f, s, Attribute, 
457, Baseball Cap, m, l, Attribute, 
458, Baseball Cap, f, s, Attribute, 
459, Bear Skin, m, l, Attribute, 
460, Bear Skin, f, s, Attribute, 
461, Beer Bong, m, l, Attribute, 
462, Beer Bong, f, s, Attribute, 
463, Beret, m, l, Attribute, 
464, Beret, f, s, Attribute, 
465, Boater, m, l, Attribute, 
466, Boater, f, s, Attribute, 
467, Bororo, m, l, Attribute, 
468, Bororo, f, s, Attribute, 
469, Chichak Helmet, m, l, Attribute, 
470, Chichak Helmet, f, s, Attribute, 
471, Chinese Landlords Hat, m, l, Attribute, 
472, Chinese Landlords Hat, f, s, Attribute, 
473, Chullo, m, l, Attribute, 
474, Chullo, f, s, Attribute, 
475, Fedora 2, m, l, Attribute, 
476, Fedora 2, f, s, Attribute, 
477, Fez, m, l, Attribute, 
478, Fez, f, s, Attribute, 
479, Fisherman Cap, m, l, Attribute, 
480, Fisherman Cap, f, s, Attribute, 
481, Flamenco Hat, m, l, Attribute, 
482, Flamenco Hat, f, s, Attribute, 
483, Flower Crown, m, l, Attribute, 
484, Flower Crown, f, s, Attribute, 
485, Gat, m, l, Attribute, 
486, Gat, f, s, Attribute, 
487, Gaucho, m, l, Attribute, 
488, Gaucho, f, s, Attribute, 
489, Hennin, m, l, Attribute, 
490, Hennin, f, s, Attribute, 
491, Isicholo, m, l, Attribute, 
492, Isicholo, f, s, Attribute, 
493, Jaapi, m, l, Attribute, 
494, Jaapi, f, s, Attribute, 
495, Keffiyeh, m, l, Attribute, 
496, Keffiyeh, f, s, Attribute, 
497, Krakowiak, m, l, Attribute, 
498, Krakowiak, f, s, Attribute, 
499, Misango Cap, m, l, Attribute, 
500, Misango Cap, f, s, Attribute, 
501, Newsboy Cap, m, l, Attribute, 
502, Panama Hat, m, l, Attribute, 
503, Panama Hat, f, s, Attribute, 
504, Rasta, m, l, Attribute, 
505, Rasta, f, s, Attribute, 
506, Royal Cocktail Hat, f, s, Attribute, 
507, Sibenik, m, l, Attribute, 
508, Sibenik, f, s, Attribute, 
509, Sombrero 2, m, l, Attribute, 
510, Sombrero 2, f, s, Attribute, 
511, Tam-O-Shanter, m, l, Attribute, 
512, Tam-O-Shanter, f, s, Attribute, 
513, Trapper Hat, m, l, Attribute, 
514, Trapper Hat, f, s, Attribute, 
515, Tuque, m, l, Attribute, 
516, Tuque, f, s, Attribute, 
517, Turban, m, l, Attribute, 
518, Turban, f, s, Attribute, 
519, Tyrolean, m, l, Attribute, 
520, Tyrolean, f, s, Attribute, 
521, Ushanka, m, l, Attribute, 
522, Ushanka, f, s, Attribute, 
523, Viking Hat, m, l, Attribute, 
524, Viking Hat, f, s, Attribute, 
525, White Shemagh, m, l, Attribute, 
526, White Shemagh & Agal, m, l, Attribute, 
527, White Shemagh & Gold Agal, m, l, Attribute, 
528, White Shemagh & Stylish Gold Agal, m, l, Attribute, 
529, White Shemagh & Crown, m, l, Attribute, 
530, Brown Shemagh & Agal, m, l, Attribute, 
531, Brown Shemagh & Crown, m, l, Attribute, 
532, Red Shemagh, m, l, Attribute, 
533, Red Shemagh & Agal, m, l, Attribute, 
534, Red Shemagh & Crown, m, l, Attribute, 
535, Niquab Black, f, s, Attribute, 
536, Niquab Blue, f, s, Attribute, 
537, Cap, u, l, Attribute, 
538, Cap, f, s, Attribute, 
539, Cap 0°, u, l, Attribute, Cap Red
540, Cap 0°, f, s, Attribute, Cap Red
541, Cap 30°, u, l, Attribute, Cap Orange
542, Cap 30°, f, s, Attribute, Cap Orange
543, Cap 60°, u, l, Attribute, Cap Yellow
544, Cap 60°, f, s, Attribute, Cap Yellow
545, Cap 90°, u, l, Attribute, Cap Yellow Green
546, Cap 90°, f, s, Attribute, Cap Yellow Green
547, Cap 120°, u, l, Attribute, Cap Green
548, Cap 120°, f, s, Attribute, Cap Green
549, Cap 150°, u, l, Attribute, Cap Cyan Green
550, Cap 150°, f, s, Attribute, Cap Cyan Green
551, Cap 180°, u, l, Attribute, Cap Cyan
552, Cap 180°, f, s, Attribute, Cap Cyan
553, Cap 210°, u, l, Attribute, Cap Cyan Blue
554, Cap 210°, f, s, Attribute, Cap Cyan Blue
555, Cap 240°, u, l, Attribute, Cap Blue
556, Cap 240°, f, s, Attribute, Cap Blue
557, Cap 270°, u, l, Attribute, Cap Violet
558, Cap 270°, f, s, Attribute, Cap Violet
559, Cap 300°, u, l, Attribute, Cap Magenta
560, Cap 300°, f, s, Attribute, Cap Magenta
561, Cap 330°, u, l, Attribute, Cap Red Magenta
562, Cap 330°, f, s, Attribute, Cap Red Magenta
563, Cap Br, u, l, Attribute, Cap Baskin-Robbins
564, Cap Br Flipped, u, l, Attribute, Cap Baskin-Robbins Flipped
565, Cap Br, f, s, Attribute, Cap Baskin-Robbins
566, Cap Br Flipped, f, s, Attribute, Cap Baskin-Robbins Flipped
567, Cap Brk, u, l, Attribute, Cap Burger King
568, Cap Burger King Flipped, u, l  Cap Brk Flipped, Attribute, 
569, Cap Brk, f, s, Attribute, Cap Burger King
570, Cap Burger King Flipped, f, s  Cap Brk Flipped, Attribute, 
571, Cap Castle, u, l, Attribute, Cap White Castle
572, Cap Castle Flipped, u, l, Attribute, Cap White Castle Flipped
573, Cap Castle, f, s, Attribute, Cap White Castle
574, Cap Castle Flipped, f, s, Attribute, Cap White Castle Flipped
575, Cap Dom, u, l, Attribute, Cap Domino's | Cap Domino's Pizza
576, Cap Dom Flipped, u, l, Attribute, Cap Domino's Flipped | Cap Domino's Pizza Flipped
577, Cap Dom, f, s, Attribute, Cap Domino's | Cap Domino's Pizza
578, Cap Dom Flipped, f, s, Attribute, Cap Domino's Flipped | Cap Domino's Pizza Flipped
579, Cap Dunk, u, l, Attribute, Cap Dunkin' | Cap Dunkin' Donuts
580, Cap Dunk Flipped, u, l, Attribute, Cap Dunkin' Flipped | Cap Dunkin' Donuts Flipped
581, Cap Dunk, f, s, Attribute, Cap Dunkin' | Cap Dunkin' Donuts
582, Cap Dunk Flipped, f, s, Attribute, Cap Dunkin' Flipped | Cap Dunkin' Donuts Flipped
583, Cap Hut, u, l, Attribute, Cap Pizza Hut
584, Cap Hut Flipped, u, l, Attribute, Cap Pizza Hut Flipped
585, Cap Hut, f, s, Attribute, Cap Pizza Hut
586, Cap Hut Flipped, f, s, Attribute, Cap Pizza Hut Flipped
587, Cap Jack, u, l, Attribute, Cap Jack in the Box
588, Cap Jack Flipped, u, l, Attribute, Cap Jack in the Box Flipped
589, Cap Jack, f, s, Attribute, Cap Jack in the Box
590, Cap Jack Flipped, f, s, Attribute, Cap Jack in the Box Flipped
591, Cap Kentucky, u, l, Attribute, Cap KFC | Cap Kentucky Fried Chicken
592, Cap Kentucky Flipped, u, l, Attribute, Cap KFC Flipped | Cap Kentucky Fried Chicken Flipped
593, Cap Kentucky, f, s, Attribute, Cap KFC | Cap Kentucky Fried Chicken
594, Cap Kentucky Flipped, f, s, Attribute, Cap KFC Flipped | Cap Kentucky Fried Chicken Flipped
595, Cap M, u, l, Attribute, Cap McDonald's | Cap M Red | Cap McDonald's Red
596, Cap M Flipped, u, l, Attribute, Cap McDonald's Flipped | Cap M Red Flipped | Cap McDonald's Red Flipped
597, Cap M White, u, l, Attribute, Cap McDonald's White
598, Cap M White Flipped, u, l, Attribute, Cap McDonald's White Flipped
599, Cap M Gray, u, l, Attribute, Cap McDonald's Gray
600, Cap M Gray Flipped, u, l, Attribute, Cap McDonald's Gray Flipped
601, Cap M Black, u, l, Attribute, Cap McDonald's Black
602, Cap M Black Flipped, u, l, Attribute, Cap McDonald's Black Flipped
603, Cap M, f, s, Attribute, Cap McDonald's | Cap M Red | Cap McDonald's Red
604, Cap M Flipped, f, s, Attribute, Cap McDonald's Flipped | Cap M Red Flipped | Cap McDonald's Red Flipped
605, Cap M White, f, s, Attribute, Cap McDonald's White
606, Cap M White Flipped, f, s, Attribute, Cap McDonald's White Flipped
607, Cap M Gray, f, s, Attribute, Cap McDonald's Gray
608, Cap M Gray Flipped, f, s, Attribute, Cap McDonald's Gray Flipped
609, Cap M Black, f, s, Attribute, Cap McDonald's Black
610, Cap M Black Flipped, f, s, Attribute, Cap McDonald's Black Flipped
611, Cap Sub, u, l, Attribute, Cap Subway
612, Cap Sub Flipped, u, l, Attribute, Cap Subway Flipped
613, Cap Sub, f, s, Attribute, Cap Subway
614, Cap Sub Flipped, f, s, Attribute, Cap Subway Flipped
615, Cap W, u, l, Attribute, Cap Wendy's
616, Cap W Flipped, u, l, Attribute, Cap Wendy's Flipped
617, Cap W, f, s, Attribute, Cap Wendy's
618, Cap W Flipped, f, s, Attribute, Cap Wendy's Flipped
619, Bucket Hat M, u, l, Attribute, Bucket Hat McDonald's
620, Cowboy Hat M, u, l, Attribute, Cowboy Hat McDonald's
621, Crown Brk, u, l, Attribute, Crown Burger King | Burger King Crown
622, Safari Hat Kentucky, u, l, Attribute, Safari Hat KFC | Safari Hat Kentucky Fried Chicken
623, Blonde Short, f, s, Attribute, 
624, Crazy Hair, m, l, Attribute, 
625, Crazy Hair, f, s, Attribute, 
626, Crazy Hair, f, l, Attribute, 
627, Dark Hair, f, s, Attribute, 
628, Frumpy Hair, m, l, Attribute, 
629, Frumpy Hair, f, s, Attribute, 
630, Half Shaved, f, s, Attribute, 
631, Messy Hair, u, l, Attribute, 
632, Messy Hair, f, s, Attribute, 
633, Mohawk, u, l, Attribute, 
634, Mohawk, f, s, Attribute, 
635, Mohawk Dark, u, l, Attribute, 
636, Mohawk Dark, f, s, Attribute, 
637, Mohawk Thin, u, l, Attribute, 
638, Mohawk Thin, f, s, Attribute, 
639, Orange Side, f, s, Attribute, 
640, Peak Spike, m, l, Attribute, 
641, Pigtails, f, s, Attribute, 
642, Pink with Hat, f, s, Attribute, 
643, Purple Hair, m, l, Attribute, 
644, Purple Hair, f, s, Attribute, 
645, Red Mohawk, f, s, Attribute, 
646, Shaved Head, u, l, Attribute, 
647, Shaved Head, f, s, Attribute, 
648, Straight Hair, f, s, Attribute, 
649, Straight Hair Blonde, f, s, Attribute, 
650, Straight Hair Dark, f, s, Attribute, 
651, Stringy Hair, u, l, Attribute, 
652, Stringy Hair, f, s, Attribute, 
653, Vampire Hair, m, l, Attribute, 
654, Wild Blonde, f, s, Attribute, 
655, Wild Hair, m, l, Attribute, 
656, Wild Hair, f, s, Attribute, 
657, Wild Hair, f, l, Attribute, 
658, Wild White Hair, f, s, Attribute, 
659, Black Afro, u, l, Attribute, 
660, Black Afro, f, s, Attribute, 
661, Brown Afro, u, l, Attribute, 
662, Dark Red Afro, u, l, Attribute, 
663, Orange Afro, u, l, Attribute, 
664, Red Afro, u, l, Attribute, 
665, Pink Afro, u, l, Attribute, 
666, Purple Afro, u, l, Attribute, 
667, Blue Afro, u, l, Attribute, 
668, Periwinkle Afro, u, l, Attribute, 
669, Light Blue Afro, u, l, Attribute, 
670, Light Green Afro, u, l, Attribute, 
671, Green Afro, u, l, Attribute, 
672, Teal Afro, u, l, Attribute, 
673, Blonde Afro, u, l, Attribute, 
674, Silver Afro, u, l, Attribute, 
675, White Afro, u, l, Attribute, 
676, Brown Afro, f, s, Attribute, 
677, Dark Red Afro, f, s, Attribute, 
678, Orange Afro, f, s, Attribute, 
679, Red Afro, f, s, Attribute, 
680, Pink Afro, f, s, Attribute, 
681, Purple Afro, f, s, Attribute, 
682, Blue Afro, f, s, Attribute, 
683, Periwinkle Afro, f, s, Attribute, 
684, Light Blue Afro, f, s, Attribute, 
685, Light Green Afro, f, s, Attribute, 
686, Green Afro, f, s, Attribute, 
687, Teal Afro, f, s, Attribute, 
688, Blonde Afro, f, s, Attribute, 
689, Silver Afro, f, s, Attribute, 
690, White Afro, f, s, Attribute, 
691, Big Hair Black, u, l, Attribute, 
692, Big Hair Black, f, s, Attribute, 
693, Big Hair Brown, u, l, Attribute, 
694, Big Hair Dark Red, u, l, Attribute, 
695, Big Hair Orange, u, l, Attribute, 
696, Big Hair Red, u, l, Attribute, 
697, Big Hair Pink, u, l, Attribute, 
698, Big Hair Purple, u, l, Attribute, 
699, Big Hair Blue, u, l, Attribute, 
700, Big Hair Periwinkle, u, l, Attribute, 
701, Big Hair Light Blue, u, l, Attribute, 
702, Big Hair Light Green, u, l, Attribute, 
703, Big Hair Green, u, l, Attribute, 
704, Big Hair Teal, u, l, Attribute, 
705, Big Hair Blonde, u, l, Attribute, 
706, Big Hair Silver, u, l, Attribute, 
707, Big Hair White, u, l, Attribute, 
708, Big Hair Brown, f, s, Attribute, 
709, Big Hair Dark Red, f, s, Attribute, 
710, Big Hair Orange, f, s, Attribute, 
711, Big Hair Red, f, s, Attribute, 
712, Big Hair Pink, f, s, Attribute, 
713, Big Hair Purple, f, s, Attribute, 
714, Big Hair Blue, f, s, Attribute, 
715, Big Hair Periwinkle, f, s, Attribute, 
716, Big Hair Light Blue, f, s, Attribute, 
717, Big Hair Light Green, f, s, Attribute, 
718, Big Hair Green, f, s, Attribute, 
719, Big Hair Teal, f, s, Attribute, 
720, Big Hair Blonde, f, s, Attribute, 
721, Big Hair Silver, f, s, Attribute, 
722, Big Hair White, f, s, Attribute, 
723, Black Bob, f, s, Attribute, 
724, Brown Bob, f, s, Attribute, 
725, Dark Red Bob, f, s, Attribute, 
726, Orange Bob, f, s, Attribute, 
727, Red Bob, f, s, Attribute, 
728, Pink Bob, f, s, Attribute, 
729, Purple Bob, f, s, Attribute, 
730, Blue Bob, f, s, Attribute, 
731, Periwinkle Bob, f, s, Attribute, 
732, Light Blue Bob, f, s, Attribute, 
733, Light Green Bob, f, s, Attribute, 
734, Green Bob, f, s, Attribute, 
735, Teal Bob, f, s, Attribute, 
736, Silver Bob, f, s, Attribute, 
737, White Bob, f, s, Attribute, 
738, Blonde Bob, f, l, Attribute, 
739, Blonde Bob, f, s, Attribute, 
740, Blonder Bob, f, s, Attribute, 
741, Black Buzz Cut, u, l, Attribute, 
742, Black Buzz Cut, f, s, Attribute, 
743, Brown Buzz Cut, u, l, Attribute, 
744, Dark Red Buzz Cut, u, l, Attribute, 
745, Orange Buzz Cut, u, l, Attribute, 
746, Red Buzz Cut, u, l, Attribute, 
747, Pink Buzz Cut, u, l, Attribute, 
748, Purple Buzz Cut, u, l, Attribute, 
749, Blue Buzz Cut, u, l, Attribute, 
750, Periwinkle Buzz Cut, u, l, Attribute, 
751, Light Blue Buzz Cut, u, l, Attribute, 
752, Light Green Buzz Cut, u, l, Attribute, 
753, Green Buzz Cut, u, l, Attribute, 
754, Teal Buzz Cut, u, l, Attribute, 
755, Blonde Buzz Cut, u, l, Attribute, 
756, Silver Buzz Cut, u, l, Attribute, 
757, White Buzz Cut, u, l, Attribute, 
758, Brown Buzz Cut, f, s, Attribute, 
759, Dark Red Buzz Cut, f, s, Attribute, 
760, Orange Buzz Cut, f, s, Attribute, 
761, Red Buzz Cut, f, s, Attribute, 
762, Pink Buzz Cut, f, s, Attribute, 
763, Purple Buzz Cut, f, s, Attribute, 
764, Blue Buzz Cut, f, s, Attribute, 
765, Periwinkle Buzz Cut, f, s, Attribute, 
766, Light Blue Buzz Cut, f, s, Attribute, 
767, Light Green Buzz Cut, f, s, Attribute, 
768, Green Buzz Cut, f, s, Attribute, 
769, Teal Buzz Cut, f, s, Attribute, 
770, Blonde Buzz Cut, f, s, Attribute, 
771, Silver Buzz Cut, f, s, Attribute, 
772, White Buzz Cut, f, s, Attribute, 
773, Clown Hair Black, m, l, Attribute, 
774, Clown Hair Black, f, s, Attribute, 
775, Clown Hair Brown, m, l, Attribute, 
776, Clown Hair Dark Red, m, l, Attribute, 
777, Clown Hair Orange, m, l, Attribute, 
778, Clown Hair Red, m, l, Attribute, 
779, Clown Hair Pink, m, l, Attribute, 
780, Clown Hair Purple, m, l, Attribute, 
781, Clown Hair Blue, m, l, Attribute, 
782, Clown Hair Periwinkle, m, l, Attribute, 
783, Clown Hair Light Blue, m, l, Attribute, 
784, Clown Hair Light Green, m, l, Attribute, 
785, Clown Hair Green, m, l, Attribute, 
786, Clown Hair Teal, m, l, Attribute, 
787, Clown Hair Blonde, m, l, Attribute, 
788, Clown Hair Silver, m, l, Attribute, 
789, Clown Hair White, m, l, Attribute, 
790, Clown Hair Brown, f, s, Attribute, 
791, Clown Hair Dark Red, f, s, Attribute, 
792, Clown Hair Orange, f, s, Attribute, 
793, Clown Hair Red, f, s, Attribute, 
794, Clown Hair Pink, f, s, Attribute, 
795, Clown Hair Purple, f, s, Attribute, 
796, Clown Hair Blue, f, s, Attribute, 
797, Clown Hair Periwinkle, f, s, Attribute, 
798, Clown Hair Light Blue, f, s, Attribute, 
799, Clown Hair Light Green, f, s, Attribute, 
800, Clown Hair Green, f, s, Attribute, 
801, Clown Hair Teal, f, s, Attribute, 
802, Clown Hair Blonde, f, s, Attribute, 
803, Clown Hair Silver, f, s, Attribute, 
804, Clown Hair White, f, s, Attribute, 
805, Wallstreetbets Hair 1, m, l, Attribute, Wallstreetbets Hair
806, Wallstreetbets Hair 2, m, l, Attribute, Wallstreetbets Crazy Hair
807, Wallstreetbets Hair 3, m, l, Attribute, 
808, Wallstreetbets Hair Dark 1, m, l, Attribute, Wallstreetbets Hair Dark
809, Wallstreetbets Hair Dark 2, m, l, Attribute, Wallstreetbets Crazy Hair Dark
810, Wallstreetbets Hair Dark 3, m, l, Attribute, 
811, Rainbow Hair, m, l, Attribute, 
812, Rainbow Hair, f, s, Attribute, 
813, Top Hat B&W, u, l, Attribute, 
814, Top Hat B&W, f, s, Attribute, 
815, 3D Glasses B&W, u, l, Attribute, 
816, Alien Eyes B&W, u, l, Attribute, 
817, Ape Front B&W, u, l, Attribute, Frankenstein Front B&W | Head Front B&W
818, Ape Nose B&W, u, l, Attribute, 
819, Bandana B&W, u, l, Attribute, 
820, Beanie B&W, u, l, Attribute, 
821, Bear Hood B&W, u, l, Attribute, 
822, Bubble Gum B&W, u, l, Attribute, 
823, Cap B&W, u, l, Attribute, 
824, Cap Forward B&W, u, l, Attribute, 
825, Cigarette B&W, u, l, Attribute, 
826, Clown Eyes B&W, u, l, Attribute, 
827, Clown Nose B&W, u, l, Attribute, 
828, Cowboy Hat B&W, u, l, Attribute, 
829, Crazy Hair B&W, u, l, Attribute, 
830, Earring B&W, u, l, Attribute, 
831, Eyes B&W, u, l, Attribute, 
832, Fedora B&W, u, l, Attribute, 
833, Frown B&W, u, l, Attribute, 
