id, name, gender, size, type, more_names
0, Human B&W, m, l, Archetype - Human, Human Male B&W | Human B&W ♂ | Male B&W | Male 1-Bit
1, Human 1 (F), m, l, Archetype - Human, Human Male 1 (F) | Human 1 ♂ (F) | Male 1-I (F) | Male 1 (F) | Man 1 (F) | ♂ 1 (F)
2, Human 2 (F), m, l, Archetype - Human, Human Male 2 (F) | Human 2 ♂ (F) | Male 2-I (F) | Male 2 (F) | Man 2 (F) | ♂ 2 (F)
3, Human 3 (F), m, l, Archetype - Human, Human Male 3 (F) | Human 3 ♂ (F) | Male 3-I (F) | Male 3 (F) | Man 3 (F) | ♂ 3 (F)
4, Human 4 (F), m, l, Archetype - Human, Human Male 4 (F) | Human 4 ♂ (F) | Male 4-I (F) | Male 4 (F) | Man 4 (F) | ♂ 4 (F)
5, Human 1, m, l, Archetype - Human, Human Male 1 | Human 1 ♂ | Male 1 | Man 1 | ♂ 1
6, Human 2, m, l, Archetype - Human, Human Male 2 | Human 2 ♂ | Male 2 | Man 2 | ♂ 2
7, Human 3, m, l, Archetype - Human, Human Male 3 | Human 3 ♂ | Male 3 | Man 3 | ♂ 3
8, Human 4, m, l, Archetype - Human, Human Male 4 | Human 4 ♂ | Male 4 | Man 4 | ♂ 4
9, Human 1 (N), m, l, Archetype - Human, Human Male 1 (N) | Human 1 ♂ (N) | Male 1 (N) | Man 1 (N) | ♂ 1 (N)
10, Human 2 (N), m, l, Archetype - Human, Human Male 2 (N) | Human 2 ♂ (N) | Male 2 (N) | Man 2 (N) | ♂ 2 (N)
11, Human 3 (N), m, l, Archetype - Human, Human Male 3 (N) | Human 3 ♂ (N) | Male 3 (N) | Man 3 (N) | ♂ 3 (N)
12, Human 4 (N), m, l, Archetype - Human, Human Male 4 (N) | Human 4 ♂ (N) | Male 4 (N) | Man 4 (N) | ♂ 4 (N)
13, Human Female B&W, f, l, Archetype - Human, Human B&W ♀ | Female B&W | Female 1-Bit
14, Human Female 1 (F), f, l, Archetype - Human, Human 1 ♀ (F) | Female 1-I (F) | Female 1 (F) | Woman 1 (F) | Lady 1 (F) | ♀ 1 (F)
15, Human Female 2 (F), f, l, Archetype - Human, Human 2 ♀ (F) | Female 2-I (F) | Female 2 (F) | Woman 2 (F) | Lady 2 (F) | ♀ 2 (F)
16, Human Female 3 (F), f, l, Archetype - Human, Human 3 ♀ (F) | Female 3-I (F) | Female 3 (F) | Woman 3 (F) | Lady 3 (F) | ♀ 3 (F)
17, Human Female 4 (F), f, l, Archetype - Human, Human 4 ♀ (F) | Female 4-I (F) | Female 4 (F) | Woman 4 (F) | Lady 4 (F) | ♀ 4 (F)
18, Human Female 1 (U), f, l, Archetype - Human, Human 1 ♀ (U) | Female 1 (U) | Woman 1 (U) | Lady 1 (U) | ♀ 1 (U)
19, Human Female 2 (U), f, l, Archetype - Human, Human 2 ♀ (U) | Female 2 (U) | Woman 2 (U) | Lady 2 (U) | ♀ 2 (U)
20, Human Female 3 (U), f, l, Archetype - Human, Human 3 ♀ (U) | Female 3 (U) | Woman 3 (U) | Lady 3 (U) | ♀ 3 (U)
21, Human Female 4 (U), f, l, Archetype - Human, Human 4 ♀ (U) | Female 4 (U) | Woman 4 (U) | Lady 4 (U) | ♀ 4 (U)
22, Human Female 1, f, s, Archetype - Human, Human 1 ♀ | Female 1 | Woman 1 | Lady 1 | ♀ 1
23, Human Female 2, f, s, Archetype - Human, Human 2 ♀ | Female 2 | Woman 2 | Lady 2 | ♀ 2
24, Human Female 3, f, s, Archetype - Human, Human 3 ♀ | Female 3 | Woman 3 | Lady 3 | ♀ 3
25, Human Female 4, f, s, Archetype - Human, Human 4 ♀ | Female 4 | Woman 4 | Lady 4 | ♀ 4
26, Human Female 1 (N), f, s, Archetype - Human, Human 1 ♀ (N) | Female 1 (N) | Woman 1 (N) | Lady 1 (N) | ♀ 1 (N)
27, Human Female 2 (N), f, s, Archetype - Human, Human 2 ♀ (N) | Female 2 (N) | Woman 2 (N) | Lady 2 (N) | ♀ 2 (N)
28, Human Female 3 (N), f, s, Archetype - Human, Human 3 ♀ (N) | Female 3 (N) | Woman 3 (N) | Lady 3 (N) | ♀ 3 (N)
29, Human Female 4 (N), f, s, Archetype - Human, Human 4 ♀ (N) | Female 4 (N) | Woman 4 (N) | Lady 4 (N) | ♀ 4 (N)
30, Zombie, m, l, Archetype - Zombie, Zombie Male | Zombie ♂
31, Zombie (N), m, l, Archetype - Zombie, Zombie Male (N) | Zombie ♂ (N)
32, Zombie (N2), m, l, Archetype - Zombie, Zombie Male (N2) | Zombie ♂ (N2)
33, Zombie Female (U), f, l, Archetype - Zombie, Zombie ♀ (U) | Lady Zombie (U)
34, Zombie Female, f, s, Archetype - Zombie, Zombie ♀ | Lady Zombie
35, Ape, m, l, Archetype - Ape, Ape Male | Ape ♂
36, Ape (N), m, l, Archetype - Ape, Ape Male (N) | Ape ♂ (N)
37, Ape (N2), m, l, Archetype - Ape, Ape Male (N2) | Ape ♂ (N2)
38, Ape Female (U), f, l, Archetype - Ape, Ape ♀ (U) | Lady Ape (U)
39, Ape Female, f, s, Archetype - Ape, Ape ♀ | Lady Ape
40, Alien B&W, m, l, Archetype - Alien, Alien Male B&W | Alien B&W ♂ | Alien 1-Bit | Alien Male 1-Bit
41, Alien, m, l, Archetype - Alien, Alien Male | Alien ♂
42, Alien (N), m, l, Archetype - Alien, Alien Male (N) | Alien ♂ (N)
43, Alien (N2), m, l, Archetype - Alien, Alien Male (N2) | Alien ♂ (N2)
44, Alien Female B&W, f, l, Archetype - Alien, Alien B&W ♀ | Alien Female 1-Bit
45, Alien Female (U), f, l, Archetype - Alien, Alien ♀ (U) | Lady Alien (U)
46, Alien Female, f, s, Archetype - Alien, Alien ♀ | Lady Alien
47, Zombie (Ape), m, l, Archetype - Zombie, Zombie (Ape) Male | Zombie (Ape) ♂
48, Zombie (Ape) (N), m, l, Archetype - Zombie, Zombie (Ape) Male (N) | Zombie (Ape) ♂ (N)
49, Alien (Ape), m, l, Archetype - Alien, Alien (Ape) Male | Alien (Ape) ♂
50, Alien (Ape) (N), m, l, Archetype - Alien, Alien (Ape) Male (N) | Alien (Ape) ♂ (N)
51, Demon B&W, m, l, Archetype - Demon, Demon Male B&W | Demon B&W ♂ | Demon 1-Bit | Demon Male 1-Bit
52, Demon, m, l, Archetype - Demon, Demon Male | Demon ♂
53, Demon (N), m, l, Archetype - Demon, Demon Male (N) | Demon ♂ (N)
54, Demon Female B&W, f, l, Archetype - Demon, Demon B&W ♀ | Demon Female 1-Bit
55, Demon Female (U), f, l, Archetype - Demon, Demon ♀ (U) | Lady Demon (U)
56, Demon Female, f, s, Archetype - Demon, Demon ♀ | Lady Demon
57, Ghost, m, l, Archetype - Ghost, Ghost Male | Ghost ♂
58, Ghost Female (U), f, l, Archetype - Ghost, Ghost ♀ (U) | Lady Ghost (U)
59, Ghost Female, f, s, Archetype - Ghost, Ghost ♀ | Lady Ghost
60, Mummy, m, l, Archetype - Mummy, Mummy Male | Mummy ♂
61, Mummy Female (U), f, l, Archetype - Mummy, Mummy ♀ (U) | Lady Mummy (U)
62, Mummy Female, f, s, Archetype - Mummy, Mummy ♀ | Lady Mummy
63, Orc B&W, m, l, Archetype - Orc, Orc Male B&W | Orc B&W ♂ | Orc 1-Bit | Orc Male 1-Bit
64, Orc, m, l, Archetype - Orc, Orc Male | Orc ♂
65, Orc Female B&W, f, l, Archetype - Orc, Orc B&W ♀ | Orc Female 1-Bit
66, Orc Female (U), f, l, Archetype - Orc, Orc ♀ (U) | Lady Orc (U)
67, Orc Female, f, s, Archetype - Orc, Orc ♀ | Lady Orc
68, Robot B&W, m, l, Archetype - Robot, Robot Male B&W | Robot B&W ♂ | Robot 1-Bit | Robot Male 1-Bit
69, Robot, m, l, Archetype - Robot, Robot Male | Robot ♂
70, Robot Female B&W, f, l, Archetype - Robot, Robot B&W ♀ | Robot Female 1-Bit
71, Robot Female (U), f, l, Archetype - Robot, Robot ♀ (U) | Lady Robot (U)
72, Robot Female, f, s, Archetype - Robot, Robot ♀ | Lady Robot
73, Skeleton, m, l, Archetype - Skeleton, Skeleton Male | Skeleton ♂
74, Skeleton (N), m, l, Archetype - Skeleton, Skeleton Male (N) | Skeleton ♂ (N)
75, Skeleton Female (U), f, l, Archetype - Skeleton, Skeleton ♀ (U) | Lady Skeleton (U)
76, Skeleton Female, f, s, Archetype - Skeleton, Skeleton ♀ | Lady Skeleton
77, Vampire B&W, m, l, Archetype - Vampire, Vampire Male B&W | Vampire B&W ♂ | Vampire 1-Bit | Vampire Male 1-Bit
78, Vampire, m, l, Archetype - Vampire, Vampire Male | Vampire ♂
79, Vampire Female B&W, f, l, Archetype - Vampire, Vampire B&W ♀ | Vampire Female 1-Bit
80, Vampire Female (U), f, l, Archetype - Vampire, Vampire ♀ (U) | Lady Vamp (U) | Lady Vampire (U)
81, Vampire Female, f, s, Archetype - Vampire, Vampire ♀ | Lady Vamp | Lady Vampire
82, Frankenstein B&W, m, l, Archetype - Frankenstein, Frankenstein Male B&W | Frankenstein B&W ♂ | Frankenstein 1-Bit | Frankenstein Male 1-Bit
83, Frankenstein, m, l, Archetype - Frankenstein, Frankenstein Male | Frankenstein ♂
84, Frankenstein Female B&W, f, l, Archetype - Frankenstein, Frankenstein B&W ♀ | Frankenstein Female 1-Bit
85, Frankenstein Female (U), f, l, Archetype - Frankenstein, Frankenstein ♀ (U)
86, Frankenstein Female, f, s, Archetype - Frankenstein, Frankenstein ♀
87, Jack-O-Lantern, m, l, Archetype - Jack-O-Lantern, Jack-O-Lantern Male | Jack-O-Lantern ♂
88, Jack-O-Lantern Female (U), f, l, Archetype - Jack-O-Lantern, Jack-O-Lantern ♀ (U)
89, Jack-O-Lantern Female, f, s, Archetype - Jack-O-Lantern, Jack-O-Lantern ♀
90, Joker, m, l, Archetype - Joker, Joker Male | Joker ♂
91, Joker Female (U), f, l, Archetype - Joker, Joker ♀ (U)
92, Joker Female, f, s, Archetype - Joker, Joker ♀
93, Scream, m, l, Archetype - Scream, Scream Male | Scream ♂
94, Scream Female (U), f, l, Archetype - Scream, Scream ♀ (U)
95, Scream Female, f, s, Archetype - Scream, Scream ♀
96, Cyborg 1, m, l, Archetype - Cyborg, Cyborg Male 1 | Cyborg 1 ♂
97, Cyborg 2, m, l, Archetype - Cyborg, Cyborg Male 2 | Cyborg 2 ♂
98, Cyborg 3, m, l, Archetype - Cyborg, Cyborg Male 3 | Cyborg 3 ♂
99, Cyborg 4, m, l, Archetype - Cyborg, Cyborg Male 4 | Cyborg 4 ♂
100, Cyborg Female 1, f, s, Archetype - Cyborg, Cyborg 1 ♀
101, Cyborg Female 2, f, s, Archetype - Cyborg, Cyborg 2 ♀
102, Cyborg Female 3, f, s, Archetype - Cyborg, Cyborg 3 ♀
103, Cyborg Female 4, f, s, Archetype - Cyborg, Cyborg 4 ♀
104, Cyborg Metal, m, l, Archetype - Cyborg, Cyborg Male Metal | Cyborg Metal ♂
105, Cyborg Female Metal, f, s, Archetype - Cyborg, Cyborg Metal ♀
106, Cyborg Ape, m, l, Archetype - Cyborg, Cyborg Male Ape | Cyborg Ape ♂
107, Cyborg Ape Metal, m, l, Archetype - Cyborg, Cyborg Male Ape Metal | Cyborg Ape Metal ♂
108, Human M10, m, l, Archetype - Human, Human Male M10 | Human M10 ♂ | Male M10 | Male MST10
109, Human M09, m, l, Archetype - Human, Human Male M09 | Human M09 ♂ | Male M09 | Male MST09
110, Human M08, m, l, Archetype - Human, Human Male M08 | Human M08 ♂ | Male M08 | Male MST08
111, Human M07, m, l, Archetype - Human, Human Male M07 | Human M07 ♂ | Male M07 | Male MST07
112, Human M06, m, l, Archetype - Human, Human Male M06 | Human M06 ♂ | Male M06 | Male MST06
113, Human M05, m, l, Archetype - Human, Human Male M05 | Human M05 ♂ | Male M05 | Male MST05
114, Human M04, m, l, Archetype - Human, Human Male M04 | Human M04 ♂ | Male M04 | Male MST04
115, Human M03, m, l, Archetype - Human, Human Male M03 | Human M03 ♂ | Male M03 | Male MST03
116, Human M02, m, l, Archetype - Human, Human Male M02 | Human M02 ♂ | Male M02 | Male MST02
117, Human M01, m, l, Archetype - Human, Human Male M01 | Human M01 ♂ | Male M01 | Male MST01
118, Human Female M10, f, s, Archetype - Human, Human M10 ♀ | Female M10 | Female MST10
119, Human Female M09, f, s, Archetype - Human, Human M09 ♀ | Female M09 | Female MST09
120, Human Female M08, f, s, Archetype - Human, Human M08 ♀ | Female M08 | Female MST08
121, Human Female M07, f, s, Archetype - Human, Human M07 ♀ | Female M07 | Female MST07
122, Human Female M06, f, s, Archetype - Human, Human M06 ♀ | Female M06 | Female MST06
123, Human Female M05, f, s, Archetype - Human, Human M05 ♀ | Female M05 | Female MST05
124, Human Female M04, f, s, Archetype - Human, Human M04 ♀ | Female M04 | Female MST04
125, Human Female M03, f, s, Archetype - Human, Human M03 ♀ | Female M03 | Female MST03
126, Human Female M02, f, s, Archetype - Human, Human M02 ♀ | Female M02 | Female MST02
127, Human Female M01, f, s, Archetype - Human, Human M01 ♀ | Female M01 | Female MST01
128, Human Chocolate, m, l, Archetype - Human, Human Male Chocolate | Human Chocolate ♂ | Male Chocolate
129, Human Espresso, m, l, Archetype - Human, Human Male Espresso | Human Espresso ♂ | Male Espresso
130, Human Golden, m, l, Archetype - Human, Human Male Golden | Human Golden ♂ | Male Golden
131, Human Umber, m, l, Archetype - Human, Human Male Umber | Human Umber ♂ | Male Umber
132, Human Bronze, m, l, Archetype - Human, Human Male Bronze | Human Bronze ♂ | Male Bronze
133, Human Chestnut, m, l, Archetype - Human, Human Male Chestnut | Human Chestnut ♂ | Male Chestnut
134, Human Almond, m, l, Archetype - Human, Human Male Almond | Human Almond ♂ | Male Almond
135, Human Band, m, l, Archetype - Human, Human Male Band | Human Band ♂ | Male Band
136, Human Honey, m, l, Archetype - Human, Human Male Honey | Human Honey ♂ | Male Honey
137, Human Sienna, m, l, Archetype - Human, Human Male Sienna | Human Sienna ♂ | Male Sienna
138, Human Beige, m, l, Archetype - Human, Human Male Beige | Human Beige ♂ | Male Beige
139, Human Limestone, m, l, Archetype - Human, Human Male Limestone | Human Limestone ♂ | Male Limestone
140, Human Rose Beige, m, l, Archetype - Human, Human Male Rose Beige | Human Rose Beige ♂ | Male Rose Beige
141, Human Sand, m, l, Archetype - Human, Human Male Sand | Human Sand ♂ | Male Sand
142, Human Warm Ivory, m, l, Archetype - Human, Human Male Warm Ivory | Human Warm Ivory ♂ | Male Warm Ivory
143, Human Pale Ivory, m, l, Archetype - Human, Human Male Pale Ivory | Human Pale Ivory ♂ | Male Pale Ivory
144, Human Porcelain, m, l, Archetype - Human, Human Male Porcelain | Human Porcelain ♂ | Male Porcelain
145, Human Ivory, m, l, Archetype - Human, Human Male Ivory | Human Ivory ♂ | Male Ivory
146, Human Orange, m, l, Archetype - Human, Human Male Orange | Human Orange ♂ | Male Orange
147, Human Warm Red, m, l, Archetype - Human, Human Male Warm Red | Human Warm Red ♂ | Male Warm Red
148, Human Red, m, l, Archetype - Human, Human Male Red | Human Red ♂ | Male Red
149, Human Rubine Red, m, l, Archetype - Human, Human Male Rubine Red | Human Rubine Red ♂ | Male Rubine Red
150, Human Pink, m, l, Archetype - Human, Human Male Pink | Human Pink ♂ | Human Barbie Pink | Human Male Barbie Pink | Human Barbie Pink ♂ | Male Pink | Male Barbie Pink
151, Human Purple, m, l, Archetype - Human, Human Male Purple | Human Purple ♂ | Male Purple
152, Human Blue, m, l, Archetype - Human, Human Male Blue | Human Blue ♂ | Male Blue
153, Human Violet, m, l, Archetype - Human, Human Male Violet | Human Violet ♂ | Male Violet
154, Human Yellow, m, l, Archetype - Human, Human Male Yellow | Human Yellow ♂ | Male Yellow
155, Human Female Chocolate, f, s, Archetype - Human, Human Chocolate ♀ | Female Chocolate
156, Human Female Espresso, f, s, Archetype - Human, Human Espresso ♀ | Female Espresso
157, Human Female Golden, f, s, Archetype - Human, Human Golden ♀ | Female Golden
158, Human Female Umber, f, s, Archetype - Human, Human Umber ♀ | Female Umber
159, Human Female Bronze, f, s, Archetype - Human, Human Bronze ♀ | Female Bronze
160, Human Female Chestnut, f, s, Archetype - Human, Human Chestnut ♀ | Female Chestnut
161, Human Female Almond, f, s, Archetype - Human, Human Almond ♀ | Female Almond
162, Human Female Band, f, s, Archetype - Human, Human Band ♀ | Female Band
163, Human Female Honey, f, s, Archetype - Human, Human Honey ♀ | Female Honey
164, Human Female Sienna, f, s, Archetype - Human, Human Sienna ♀ | Female Sienna
165, Human Female Beige, f, s, Archetype - Human, Human Beige ♀ | Female Beige
166, Human Female Limestone, f, s, Archetype - Human, Human Limestone ♀ | Female Limestone
167, Human Female Rose Beige, f, s, Archetype - Human, Human Rose Beige ♀ | Female Rose Beige
168, Human Female Sand, f, s, Archetype - Human, Human Sand ♀ | Female Sand
169, Human Female Warm Ivory, f, s, Archetype - Human, Human Warm Ivory ♀ | Female Warm Ivory
170, Human Female Pale Ivory, f, s, Archetype - Human, Human Pale Ivory ♀ | Female Pale Ivory
171, Human Female Porcelain, f, s, Archetype - Human, Human Porcelain ♀ | Female Porcelain
172, Human Female Ivory, f, s, Archetype - Human, Human Ivory ♀ | Female Ivory
173, Human Female Orange, f, s, Archetype - Human, Human Orange ♀ | Female Orange
174, Human Female Warm Red, f, s, Archetype - Human, Human Warm Red ♀ | Female Warm Red
175, Human Female Red, f, s, Archetype - Human, Human Red ♀ | Female Red
176, Human Female Rubine Red, f, s, Archetype - Human, Human Rubine Red ♀ | Female Rubine Red
177, Human Female Pink, f, s, Archetype - Human, Human Pink ♀ | Human Female Barbie Pink | Human Barbie Pink ♀ | Female Pink | Female Barbie Pink
178, Human Female Purple, f, s, Archetype - Human, Human Purple ♀ | Female Purple
179, Human Female Blue, f, s, Archetype - Human, Human Blue ♀ | Female Blue
180, Human Female Violet, f, s, Archetype - Human, Human Violet ♀ | Female Violet
181, Human Female Yellow, f, s, Archetype - Human, Human Yellow ♀ | Female Yellow
182, Human Gold 1, m, l, Archetype - Human, Human Male Gold 1 | Human Gold 1 ♂ | Human Gold | Human Male Gold | Human Gold ♂ | Male Gold 1 | Male Gold
183, Human Gold 2, m, l, Archetype - Human, Human Male Gold 2 | Human Gold 2 ♂ | Human Goldenrod | Human Male Goldenrod | Human Goldenrod ♂ | Male Gold 2 | Male Goldenrod
184, Human Gold 3, m, l, Archetype - Human, Human Male Gold 3 | Human Gold 3 ♂ | Human Dark Goldenrod | Human Male Dark Goldenrod | Human Dark Goldenrod ♂ | Male Gold 3 | Male Dark Goldenrod
185, Human Female Gold 1, f, s, Archetype - Human, Human Gold 1 ♀ | Human Female Gold | Human Gold ♀ | Female Gold 1 | Female Gold
186, Human Female Gold 2, f, s, Archetype - Human, Human Gold 2 ♀ | Human Female Goldenrod | Human Goldenrod ♀ | Female Gold 2 | Female Goldenrod
187, Human Female Gold 3, f, s, Archetype - Human, Human Gold 3 ♀ | Human Female Dark Goldenrod | Human Dark Goldenrod ♀ | Female Gold 3 | Female Dark Goldenrod
188, Zombie Gold 1, m, l, Archetype - Zombie, Zombie Male Gold 1 | Zombie Gold 1 ♂ | Zombie Gold | Zombie Male Gold | Zombie Gold ♂
189, Zombie Gold 2, m, l, Archetype - Zombie, Zombie Male Gold 2 | Zombie Gold 2 ♂ | Zombie Goldenrod | Zombie Male Goldenrod | Zombie Goldenrod ♂
190, Zombie Gold 3, m, l, Archetype - Zombie, Zombie Male Gold 3 | Zombie Gold 3 ♂ | Zombie Dark Goldenrod | Zombie Male Dark Goldenrod | Zombie Dark Goldenrod ♂
191, Zombie Female Gold 1, f, s, Archetype - Zombie, Zombie Gold 1 ♀ | Zombie Female Gold | Zombie Gold ♀
192, Zombie Female Gold 2, f, s, Archetype - Zombie, Zombie Gold 2 ♀ | Zombie Female Goldenrod | Zombie Goldenrod ♀
193, Zombie Female Gold 3, f, s, Archetype - Zombie, Zombie Gold 3 ♀ | Zombie Female Dark Goldenrod | Zombie Dark Goldenrod ♀
194, Ape Gold 1, m, l, Archetype - Ape, Ape Male Gold 1 | Ape Gold 1 ♂ | Ape Gold | Ape Male Gold | Ape Gold ♂
195, Ape Gold 2, m, l, Archetype - Ape, Ape Male Gold 2 | Ape Gold 2 ♂ | Ape Goldenrod | Ape Male Goldenrod | Ape Goldenrod ♂
196, Ape Gold 3, m, l, Archetype - Ape, Ape Male Gold 3 | Ape Gold 3 ♂ | Ape Dark Goldenrod | Ape Male Dark Goldenrod | Ape Dark Goldenrod ♂
197, Ape Female Gold 1, f, s, Archetype - Ape, Ape Gold 1 ♀ | Ape Female Gold | Ape Gold ♀
198, Ape Female Gold 2, f, s, Archetype - Ape, Ape Gold 2 ♀ | Ape Female Goldenrod | Ape Goldenrod ♀
199, Ape Female Gold 3, f, s, Archetype - Ape, Ape Gold 3 ♀ | Ape Female Dark Goldenrod | Ape Dark Goldenrod ♀
200, Alien Gold 1, m, l, Archetype - Alien, Alien Male Gold 1 | Alien Gold 1 ♂ | Alien Gold | Alien Male Gold | Alien Gold ♂
201, Alien Gold 2, m, l, Archetype - Alien, Alien Male Gold 2 | Alien Gold 2 ♂ | Alien Goldenrod | Alien Male Goldenrod | Alien Goldenrod ♂
202, Alien Gold 3, m, l, Archetype - Alien, Alien Male Gold 3 | Alien Gold 3 ♂ | Alien Dark Goldenrod | Alien Male Dark Goldenrod | Alien Dark Goldenrod ♂
203, Alien Female Gold 1, f, s, Archetype - Alien, Alien Gold 1 ♀ | Alien Female Gold | Alien Gold ♀
204, Alien Female Gold 2, f, s, Archetype - Alien, Alien Gold 2 ♀ | Alien Female Goldenrod | Alien Goldenrod ♀
205, Alien Female Gold 3, f, s, Archetype - Alien, Alien Gold 3 ♀ | Alien Female Dark Goldenrod | Alien Dark Goldenrod ♀
206, Demon Gold 1, m, l, Archetype - Demon, Demon Male Gold 1 | Demon Gold 1 ♂ | Demon Gold | Demon Male Gold | Demon Gold ♂
207, Demon Gold 2, m, l, Archetype - Demon, Demon Male Gold 2 | Demon Gold 2 ♂ | Demon Goldenrod | Demon Male Goldenrod | Demon Goldenrod ♂
208, Demon Gold 3, m, l, Archetype - Demon, Demon Male Gold 3 | Demon Gold 3 ♂ | Demon Dark Goldenrod | Demon Male Dark Goldenrod | Demon Dark Goldenrod ♂
209, Demon Female Gold 1, f, s, Archetype - Demon, Demon Gold 1 ♀ | Demon Female Gold | Demon Gold ♀
210, Demon Female Gold 2, f, s, Archetype - Demon, Demon Gold 2 ♀ | Demon Female Goldenrod | Demon Goldenrod ♀
211, Demon Female Gold 3, f, s, Archetype - Demon, Demon Gold 3 ♀ | Demon Female Dark Goldenrod | Demon Dark Goldenrod ♀
212, Skeleton Gold 1, m, l, Archetype - Skeleton, Skeleton Male Gold 1 | Skeleton Gold 1 ♂ | Skeleton Gold | Skeleton Male Gold | Skeleton Gold ♂
213, Skeleton Gold 2, m, l, Archetype - Skeleton, Skeleton Male Gold 2 | Skeleton Gold 2 ♂ | Skeleton Goldenrod | Skeleton Male Goldenrod | Skeleton Goldenrod ♂
214, Skeleton Gold 3, m, l, Archetype - Skeleton, Skeleton Male Gold 3 | Skeleton Gold 3 ♂ | Skeleton Dark Goldenrod | Skeleton Male Dark Goldenrod | Skeleton Dark Goldenrod ♂
215, Skeleton Female Gold 1, f, s, Archetype - Skeleton, Skeleton Gold 1 ♀ | Skeleton Female Gold | Skeleton Gold ♀
216, Skeleton Female Gold 2, f, s, Archetype - Skeleton, Skeleton Gold 2 ♀ | Skeleton Female Goldenrod | Skeleton Goldenrod ♀
217, Skeleton Female Gold 3, f, s, Archetype - Skeleton, Skeleton Gold 3 ♀ | Skeleton Female Dark Goldenrod | Skeleton Dark Goldenrod ♀
218, Ape Black, m, l, Archetype - Ape, Ape Male Black | Ape Black ♂
219, Ape Gray, m, l, Archetype - Ape, Ape Male Gray | Ape Gray ♂
220, Ape Dark Brown, m, l, Archetype - Ape, Ape Male Dark Brown | Ape Dark Brown ♂
221, Ape Brown, m, l, Archetype - Ape, Ape Male Brown | Ape Brown ♂
222, Ape Golden Brown, m, l, Archetype - Ape, Ape Male Golden Brown | Ape Golden Brown ♂
223, Ape Cheetah, m, l, Archetype - Ape, Ape Male Cheetah | Ape Cheetah ♂
224, Ape Blue, m, l, Archetype - Ape, Ape Male Blue | Ape Blue ♂
225, Ape DMT, m, l, Archetype - Ape, Ape Male DMT | Ape DMT ♂
226, Ape Pink, m, l, Archetype - Ape, Ape Male Pink | Ape Pink ♂
227, Ape Red, m, l, Archetype - Ape, Ape Male Red | Ape Red ♂
228, Ape Tan, m, l, Archetype - Ape, Ape Male Tan | Ape Tan ♂
229, Ape Cream, m, l, Archetype - Ape, Ape Male Cream | Ape Cream ♂
230, Ape White, m, l, Archetype - Ape, Ape Male White | Ape White ♂
231, Ape Trippy, m, l, Archetype - Ape, Ape Male Trippy | Ape Trippy ♂
232, Ape Noise, m, l, Archetype - Ape, Ape Male Noise | Ape Noise ♂
233, Ape Solid Gold, m, l, Archetype - Ape, Ape Male Solid Gold | Ape Solid Gold ♂
234, Ape Bot, m, l, Archetype - Ape, Ape Male Bot | Ape Bot ♂
235, Ape Death Bot, m, l, Archetype - Ape, Ape Male Death Bot | Ape Death Bot ♂
236, Alien 0°, m, l, Archetype - Alien, Alien Male 0° | Alien 0° ♂ | Alien Red | Alien Male Red | Alien Red ♂
237, Alien 30°, m, l, Archetype - Alien, Alien Male 30° | Alien 30° ♂ | Alien Orange | Alien Male Orange | Alien Orange ♂
238, Alien 60°, m, l, Archetype - Alien, Alien Male 60° | Alien 60° ♂ | Alien Yellow | Alien Male Yellow | Alien Yellow ♂
239, Alien 90°, m, l, Archetype - Alien, Alien Male 90° | Alien 90° ♂ | Alien Yellow Green | Alien Male Yellow Green | Alien Yellow Green ♂
240, Alien 120°, m, l, Archetype - Alien, Alien Male 120° | Alien 120° ♂ | Alien Green | Alien Male Green | Alien Green ♂
241, Alien 150°, m, l, Archetype - Alien, Alien Male 150° | Alien 150° ♂ | Alien Cyan Green | Alien Male Cyan Green | Alien Cyan Green ♂
242, Alien 180°, m, l, Archetype - Alien, Alien Male 180° | Alien 180° ♂ | Alien Cyan | Alien Male Cyan | Alien Cyan ♂
243, Alien 210°, m, l, Archetype - Alien, Alien Male 210° | Alien 210° ♂ | Alien Cyan Blue | Alien Male Cyan Blue | Alien Cyan Blue ♂
244, Alien 240°, m, l, Archetype - Alien, Alien Male 240° | Alien 240° ♂ | Alien Blue | Alien Male Blue | Alien Blue ♂
245, Alien 270°, m, l, Archetype - Alien, Alien Male 270° | Alien 270° ♂ | Alien Violet | Alien Male Violet | Alien Violet ♂
246, Alien 300°, m, l, Archetype - Alien, Alien Male 300° | Alien 300° ♂ | Alien Magenta | Alien Male Magenta | Alien Magenta ♂
247, Alien 330°, m, l, Archetype - Alien, Alien Male 330° | Alien 330° ♂ | Alien Red Magenta | Alien Male Red Magenta | Alien Red Magenta ♂
248, Alien (Ape) 0°, m, l, Archetype - Alien, Alien (Ape) Male 0° | Alien (Ape) 0° ♂ | Alien (Ape) Red | Alien (Ape) Male Red | Alien (Ape) Red ♂
249, Alien (Ape) 30°, m, l, Archetype - Alien, Alien (Ape) Male 30° | Alien (Ape) 30° ♂ | Alien (Ape) Orange | Alien (Ape) Male Orange | Alien (Ape) Orange ♂
250, Alien (Ape) 60°, m, l, Archetype - Alien, Alien (Ape) Male 60° | Alien (Ape) 60° ♂ | Alien (Ape) Yellow | Alien (Ape) Male Yellow | Alien (Ape) Yellow ♂
251, Alien (Ape) 90°, m, l, Archetype - Alien, Alien (Ape) Male 90° | Alien (Ape) 90° ♂ | Alien (Ape) Yellow Green | Alien (Ape) Male Yellow Green | Alien (Ape) Yellow Green ♂
252, Alien (Ape) 120°, m, l, Archetype - Alien, Alien (Ape) Male 120° | Alien (Ape) 120° ♂ | Alien (Ape) Green | Alien (Ape) Male Green | Alien (Ape) Green ♂
253, Alien (Ape) 150°, m, l, Archetype - Alien, Alien (Ape) Male 150° | Alien (Ape) 150° ♂ | Alien (Ape) Cyan Green | Alien (Ape) Male Cyan Green | Alien (Ape) Cyan Green ♂
254, Alien (Ape) 180°, m, l, Archetype - Alien, Alien (Ape) Male 180° | Alien (Ape) 180° ♂ | Alien (Ape) Cyan | Alien (Ape) Male Cyan | Alien (Ape) Cyan ♂
255, Alien (Ape) 210°, m, l, Archetype - Alien, Alien (Ape) Male 210° | Alien (Ape) 210° ♂ | Alien (Ape) Cyan Blue | Alien (Ape) Male Cyan Blue | Alien (Ape) Cyan Blue ♂
256, Alien (Ape) 240°, m, l, Archetype - Alien, Alien (Ape) Male 240° | Alien (Ape) 240° ♂ | Alien (Ape) Blue | Alien (Ape) Male Blue | Alien (Ape) Blue ♂
